{
  "$schema": "../schema/adapter-contract.schema.json",
  "$defs": {
    "count_result": {
      "additionalProperties": false,
      "properties": {
        "count": {
          "minimum": 0,
          "type": "integer"
        }
      },
      "type": "object",
      "required": [
        "count"
      ]
    },
    "empty": {
      "additionalProperties": false,
      "properties": {},
      "type": "object"
    },
    "handle": {
      "minLength": 1,
      "type": "string"
    },
    "insert_job": {
      "additionalProperties": false,
      "properties": {
        "behavior": {
          "description": "Built-in `conformance_echo` worker behavior; empty completes immediately.",
          "enum": [
            "",
            "barrier_output",
            "barrier_wait",
            "cancel",
            "cancel_error",
            "cancel_panic",
            "cooperative_cancel",
            "discard",
            "error",
            "ignored_cancel",
            "output",
            "panic",
            "resumable",
            "resumable_cursor",
            "resumable_duplicate",
            "sleep",
            "snooze_once",
            "snooze_then_cancel",
            "transactional_complete"
          ]
        },
        "duration_ms": {
          "minimum": 0,
          "type": "integer"
        },
        "message": {
          "type": "string"
        },
        "opts": {
          "$ref": "#/$defs/insert_opts"
        }
      },
      "type": "object"
    },
    "insert_opts": {
      "additionalProperties": false,
      "properties": {
        "max_attempts": {
          "minimum": 1,
          "type": "integer"
        },
        "metadata": {
          "type": "object"
        },
        "pending": {
          "type": "boolean"
        },
        "priority": {
          "type": "integer"
        },
        "queue": {
          "type": "string"
        },
        "scheduled_at": {
          "$ref": "#/$defs/timestamp"
        },
        "tags": {
          "items": {
            "type": "string"
          },
          "type": "array"
        },
        "unique": {
          "additionalProperties": false,
          "properties": {
            "by_args": {
              "type": "boolean"
            },
            "by_period_ms": {
              "minimum": 0,
              "type": "integer"
            },
            "by_queue": {
              "type": "boolean"
            },
            "by_state": {
              "items": {
                "$ref": "#/$defs/job_state"
              },
              "type": "array"
            },
            "exclude_kind": {
              "type": "boolean"
            }
          },
          "type": "object"
        }
      },
      "type": "object"
    },
    "insert_result": {
      "additionalProperties": false,
      "properties": {
        "job": {
          "$ref": "../schema/normalized-job.schema.json"
        },
        "unique_skipped_as_duplicate": {
          "type": "boolean"
        }
      },
      "type": "object",
      "required": [
        "job",
        "unique_skipped_as_duplicate"
      ]
    },
    "job": {
      "$ref": "../schema/normalized-job.schema.json"
    },
    "job_id": {
      "description": "Exact signed 64-bit job ID.",
      "minimum": 1,
      "type": "integer"
    },
    "job_state": {
      "enum": [
        "available",
        "cancelled",
        "completed",
        "discarded",
        "pending",
        "retryable",
        "running",
        "scheduled"
      ]
    },
    "jobs_result": {
      "additionalProperties": false,
      "properties": {
        "jobs": {
          "items": {
            "$ref": "#/$defs/job"
          },
          "type": "array"
        }
      },
      "type": "object",
      "required": [
        "jobs"
      ]
    },
    "list_result": {
      "additionalProperties": false,
      "properties": {
        "cursor": {
          "type": [
            "string",
            "null"
          ]
        },
        "jobs": {
          "items": {
            "$ref": "#/$defs/job"
          },
          "type": "array"
        }
      },
      "type": "object",
      "required": [
        "cursor",
        "jobs"
      ]
    },
    "migration_result": {
      "additionalProperties": false,
      "properties": {
        "applied": {
          "items": {
            "minimum": 1,
            "type": "integer"
          },
          "type": "array"
        },
        "existing": {
          "items": {
            "minimum": 1,
            "type": "integer"
          },
          "type": "array"
        },
        "valid": {
          "type": "boolean"
        }
      },
      "type": "object",
      "required": [
        "applied",
        "existing",
        "valid"
      ]
    },
    "queue": {
      "$ref": "../schema/normalized-queue.schema.json"
    },
    "schema_name": {
      "description": "Custom PostgreSQL schema; empty or absent selects the default. Implementations reject invalid names.",
      "type": "string"
    },
    "timestamp": {
      "description": "RFC 3339 timestamp.",
      "minLength": 1,
      "type": "string"
    }
  },
  "adapter_version": 20,
  "errors": [
    {
      "code": -32700,
      "description": "The request line is not valid JSON.",
      "name": "parse_error"
    },
    {
      "code": -32600,
      "description": "The request is not a JSON-RPC 2.0 request.",
      "name": "invalid_request"
    },
    {
      "code": -32601,
      "description": "The adapter does not implement the method in its advertised profile.",
      "name": "method_not_found"
    },
    {
      "code": -32602,
      "description": "The params do not match the method's params schema, including unknown parameters.",
      "name": "invalid_params"
    },
    {
      "code": -32000,
      "description": "The adapter itself failed; not a River outcome.",
      "name": "internal"
    },
    {
      "code": -32001,
      "description": "A requested job or queue does not exist, or a transaction handle or barrier is unknown.",
      "name": "not_found"
    },
    {
      "code": -32002,
      "description": "The implementation rejected the request or could not complete it: validation, an invalid state such as an already running client, or a wait that did not reach its states.",
      "name": "rejected"
    },
    {
      "code": -32003,
      "description": "The database reported an error, such as a statement failing in an aborted transaction.",
      "name": "database_error"
    },
    {
      "code": -32004,
      "description": "The adapter cannot honor a valid optional parameter or feature, such as a start tuning option its implementation does not expose.",
      "name": "unsupported"
    }
  ],
  "methods": [
    {
      "capability": "barriers",
      "description": "Create a named worker barrier.",
      "name": "barrier_create",
      "params": {
        "additionalProperties": false,
        "properties": {
          "name": {
            "minLength": 1,
            "type": "string"
          }
        },
        "type": "object",
        "required": [
          "name"
        ]
      },
      "result": {
        "additionalProperties": false,
        "properties": {},
        "type": "object"
      }
    },
    {
      "capability": "barriers",
      "description": "Release a named worker barrier.",
      "name": "barrier_release",
      "params": {
        "additionalProperties": false,
        "properties": {
          "name": {
            "minLength": 1,
            "type": "string"
          }
        },
        "type": "object",
        "required": [
          "name"
        ]
      },
      "result": {
        "additionalProperties": false,
        "properties": {},
        "type": "object"
      }
    },
    {
      "capability": "insert",
      "description": "Measure in-process insertion without RPC framing overhead.",
      "name": "benchmark_enqueue",
      "params": {
        "additionalProperties": false,
        "properties": {
          "jobs": {
            "minimum": 1,
            "type": "integer"
          }
        },
        "type": "object",
        "required": [
          "jobs"
        ]
      },
      "result": {
        "additionalProperties": false,
        "properties": {
          "duration_ns": {
            "minimum": 0,
            "type": "integer"
          },
          "p95_ns": {
            "minimum": 0,
            "type": "integer"
          }
        },
        "type": "object",
        "required": [
          "duration_ns",
          "p95_ns"
        ]
      }
    },
    {
      "capability": "cancel",
      "description": "Cancel a job outside a transaction.",
      "name": "cancel",
      "params": {
        "additionalProperties": false,
        "properties": {
          "id": {
            "$ref": "#/$defs/job_id"
          }
        },
        "type": "object",
        "required": [
          "id"
        ]
      },
      "result": {
        "$ref": "#/$defs/job"
      }
    },
    {
      "capability": "deterministic_controls",
      "description": "Set the adapter's deterministic test clock.",
      "name": "clock_set",
      "params": {
        "additionalProperties": false,
        "properties": {
          "now": {
            "$ref": "#/$defs/timestamp"
          }
        },
        "type": "object",
        "required": [
          "now"
        ]
      },
      "result": {
        "additionalProperties": false,
        "properties": {},
        "type": "object"
      }
    },
    {
      "capability": "lifecycle",
      "description": "Report application connections owned by the adapter.",
      "name": "connection_count",
      "params": {
        "additionalProperties": false,
        "properties": {},
        "type": "object"
      },
      "result": {
        "$ref": "#/$defs/count_result"
      }
    },
    {
      "capability": "deterministic_controls",